{
  "artifactVersion": "0.1.0",
  "generatedAt": "2026-08-14T00:00:00Z",
  "generator": {
    "model": "claude-opus-5",
    "contracts": ["orientation@0.1.0", "lens@0.1.0", "curriculum@0.1.0"],
    "kbVersion": "0.1.0"
  },
  "subject": {
    "repoName": "miniapp",
    "kbGeneratedAt": "2026-08-14T00:00:00Z"
  },

  "orientation": {
    "problem": "People accumulate short pieces of written information that they need to keep, retrieve later, and eventually discard. Holding these in memory or in scattered files means they are lost, duplicated, or unreachable from wherever the person happens to be.",
    "users": ["A signed-in individual keeping their own notes"],
    "summary": "A small two-tier application. A browser interface lists notes and creates new ones; a server holds them in a relational database and decides who may see what. The two halves are separate programs in separate languages that agree on one HTTP contract, generated from the server's schema so the agreement cannot silently drift.",
    "notInScope": [
      "Sharing or collaboration — every note belongs to one caller and there is no concept of another person seeing it",
      "Search, tagging or organisation beyond a flat list",
      "Any background or scheduled work; every action is a direct response to a request"
    ],
    "provenance": {
      "method": "inferred",
      "contract": "orientation@0.1.0",
      "confidence": 0.85,
      "evidence": {
        "nodeIds": ["route:GET /api/v1/notes/", "dataModel:backend/app/models.py#Note"],
        "sourceRefs": [{ "file": "backend/app/models.py", "startLine": 6 }]
      },
      "note": "Purpose derived from the data model and route surface; no product documentation exists in the repository to corroborate it."
    }
  },

  "lenses": [
    {
      "id": "lens.api",
      "name": "The API boundary",
      "domain": "api",
      "order": 1,
      "question": "What can a caller ask this system to do, and what stops them asking for more?",
      "summary": "Three HTTP endpoints over one resource. The interesting part is not the endpoints but the type boundary in front of them: what arrives is parsed into a declared shape before any application code runs, and what leaves is projected onto a different declared shape.",
      "conceptIds": ["concept.boundary-validation", "concept.dto-projection", "concept.contract-first-api"],
      "sections": [
        {
          "id": "sec.api.first-principles",
          "title": "Why a system validates at its edge",
          "kind": "first-principles",
          "depth": "overview",
          "firstPrinciples": {
            "subject": "Validation at the trust boundary",
            "problem": "Input arriving over a network is arbitrary bytes. Nothing about it is guaranteed — not the fields, not the types, not the ranges — yet the code receiving it is written as though it were well-formed.",
            "naive": "Check things where you use them: confirm the title is present just before saving it, confirm the length just before displaying it. This is reasonable and it is what most code does first.",
            "failure": "The checks scatter and then disagree. One path checks, another forgot, a third checks differently. Worse, you cannot look at a function and know what it is entitled to assume, so functions either re-check defensively or trust wrongly — and which of those happened is invisible at the call site.",
            "resolution": "Validate once, at the boundary, and produce a different type on success. Not a checked dictionary but an object that can only exist if validation passed, so the type system carries the guarantee inward for free.",
            "cost": "Every shape crossing the boundary needs a declared schema, kept in step with what the shape means. Validation also becomes a place where legitimate but unanticipated input is rejected, which is its own class of bug and one that looks like the client's fault.",
            "conceptId": "concept.boundary-validation"
          },
          "conceptIds": ["concept.boundary-validation"],
          "provenance": {
            "method": "inferred",
            "contract": "lens@0.1.0",
            "confidence": 0.9,
            "evidence": {},
            "note": "General engineering knowledge; makes no claim about this repository."
          }
        },
        {
          "id": "sec.api.here",
          "title": "How this system does it",
          "kind": "explanation",
          "depth": "overview",
          "body": "Each endpoint declares the type it accepts and the type it returns. `POST /api/v1/notes/` takes a `NoteCreate` and returns a `NotePublic`; the handler never sees an unvalidated request body, because the framework refuses the request before the handler is entered.\n\nThe shapes are deliberately not the table. `Note`, `NoteCreate` and `NotePublic` share a base class carrying `title` and `body`, but `Note` alone adds `internal_score`. Because `NotePublic` has no field for it, that column cannot be serialised into a response — the omission is structural rather than something a reviewer has to catch.\n\nThe frontend does not restate any of these types. They are generated from the server's schema into `frontend/src/client/types.gen.ts`, so a change on the server surfaces as a compile error rather than a runtime surprise.",
          "conceptIds": ["concept.dto-projection", "concept.contract-first-api"],
          "expansion": {
            "contractId": "lens@0.1.0#deep",
            "generated": false,
            "focus": "Field-by-field comparison of Note, NoteCreate and NotePublic, and what each omission is protecting",
            "scopeFiles": ["backend/app/models.py"]
          },
          "provenance": {
            "method": "inferred",
            "contract": "lens@0.1.0",
            "confidence": 0.95,
            "evidence": {
              "nodeIds": [
                "route:POST /api/v1/notes/",
                "dataModel:backend/app/models.py#Note",
                "dataModel:backend/app/models.py#NotePublic"
              ],
              "sourceRefs": [
                { "file": "backend/app/models.py", "startLine": 22, "endLine": 28 },
                { "file": "backend/app/api/routes/notes.py", "startLine": 23 }
              ]
            }
          }
        },
        {
          "id": "sec.api.invariant",
          "title": "What must stay true here",
          "kind": "invariant",
          "depth": "overview",
          "body": "Columns on the table that are absent from the public shape must stay absent. Nothing enforces this beyond the shape of the types: adding `internal_score` to `NotePublic` would publish it immediately, and no test would fail.",
          "provenance": {
            "method": "inferred",
            "contract": "lens@0.1.0",
            "confidence": 0.9,
            "evidence": {
              "sourceRefs": [{ "file": "backend/app/models.py", "startLine": 26, "endLine": 28 }]
            }
          }
        }
      ],
      "provenance": {
        "method": "inferred",
        "contract": "lens@0.1.0",
        "confidence": 0.9,
        "evidence": { "nodeIds": ["route:GET /api/v1/notes/", "route:POST /api/v1/notes/"] }
      }
    },

    {
      "id": "lens.frontend",
      "name": "Client state",
      "domain": "frontend",
      "order": 2,
      "question": "The browser holds a copy of data it does not own — how does it know when that copy went wrong?",
      "summary": "Fetched data lives in a cache outside the component tree, keyed by query key. Freshness is not a timer but an explicit act: the code that writes has to name what it just invalidated.",
      "conceptIds": ["concept.server-state-cache", "concept.cache-invalidation"],
      "sections": [
        {
          "id": "sec.fe.first-principles",
          "title": "Why remote data is a cache, not state",
          "kind": "first-principles",
          "depth": "overview",
          "firstPrinciples": {
            "subject": "Server state as a cache",
            "problem": "Data on the server is owned by the server and can change without telling the browser. The browser only ever holds a copy that was true at the moment it was fetched.",
            "naive": "Fetch in the component and put the result in local state, right where it is used.",
            "failure": "Two components needing the same data fetch it twice and drift apart. Every component hand-rolls its own loading and error branches. Nothing knows when a copy went stale, so a user sees old data after making a change — and the blunt fix, refetching everything, discards the copies that were still good.",
            "resolution": "Keep remote data in a cache outside the component tree, keyed by what identifies the request. Components read by key; the cache handles deduplication, loading state and refetching. Staleness becomes an explicit operation.",
            "cost": "A second source of truth to reason about, and correctness now depends on invalidating the right keys at the right moments. Forgetting produces the classic 'I added a row and the list did not update'; over-invalidating throws away the benefit the cache was for.",
            "conceptId": "concept.server-state-cache"
          },
          "conceptIds": ["concept.server-state-cache"],
          "provenance": {
            "method": "inferred",
            "contract": "lens@0.1.0",
            "confidence": 0.9,
            "evidence": {},
            "note": "General engineering knowledge; makes no claim about this repository."
          }
        },
        {
          "id": "sec.fe.here",
          "title": "The invalidation in this app",
          "kind": "walkthrough",
          "depth": "overview",